domain,id,from,to
security_concepts,2,Which algorithm provides encryption and authentication for data plane commu,Which algorithm provides encryption and authentication for data plane communication?
network_security,135,An engineer must deploy a network security management solution to provide the operations team with a unified view of the security environment. The com- pany operates a hybrid cloud with an element of on-premises private hosting for critical applications and data. The operations team requires a single solution that will be used to manage and configure: Firewalls Intrusion Prevention System Application control URL filtering Advanced malware protection-,An engineer must deploy a network security management solution to provide the operations team with a unified view of the security environment. The company operates a hybrid cloud with an element of on-premises private hosting for critical applications and data. The operations team requires a single solution that will be used to manage and configure:• Firewalls• Intrusion Prevention System• Application control• URL filtering• Advanced malware protectionWhich Cisco solution must be deployed?
endpoint_protection_and_detection,317,Which PKI enrollment method allows the user to separate authentication and enrollment actions and also provides an option to specify HTTP/TFTP com-,Which PKI enrollment method allows the user to separate authentication and enrollment actions and also provides an option to specify HTTP/TFTP commands to perform file retrieval from the server?
endpoint_protection_and_detection,370,"Which Cisco platform processes behavior baselines, monitors for deviations, and reviews for malicious processes in data center traffic and servers while perform-","Which Cisco platform processes behavior baselines, monitors for deviations, and reviews for malicious processes in data center traﬀic and servers while performing software vulnerability detection?"
endpoint_protection_and_detection,551,"316 Which Cisco platform processes behavior baselines, monitors for deviations, and reviews for malicious processes in data center traffic and servers while perform-","316 Which Cisco platform processes behavior baselines, monitors for deviations, and reviews for malicious processes in data center traﬀic and servers while performing software vulnerability detection?"
secure_network_access_visibility_and_enforcement,585,"An administrator is adding a new switch onto the network and has configured AAA for network access control. When testing the configuration, the RADIUS authenticates to Cisco ISE but is being rejected. Why is the ip radius source-","An administrator is adding a new switch onto the network and has configured AAA for network access control. When testing the configuration, the RADIUS authenticates to Cisco ISE but is being rejected. Why is the ip radius sourceinterface command needed for this configuration?"
secure_network_access_visibility_and_enforcement,591,A network administrator is configuring a switch to use Cisco ISE for 802.1X. An endpoint is failing authentication and is unable to access the network. Where should the administrator begin troubleshooting to verify the authentication de-,A network administrator is configuring a switch to use Cisco ISE for 802.1X. An endpoint is failing authentication and is unable to access the network. Where should the administrator begin troubleshooting to verify the authentication details?
